{
  "schemaVersion": 1,
  "authority": "CUNA_CANONICAL_PUBLIC_API_CONTRACT",
  "status": "APPROVED",
  "producerRepository": "Cuna-Labs/infra-proxy-mvp",
  "sourceCommit": "9a1018c732dab9b2d4fc3f41befd1b53fa53cd79",
  "contractSha256": "b960654fa64cd4bbeaab75123099216b0b5a6dcb72b7ccaf919531c5e55018a5",
  "approvalAttestationSha256": "76c1678f5c2308c352dcb6a9fe805526346352a22c3ec292b01815ba2a3b0181"
}
